product_category,brand,product_name,user_id,BIP_level,BIC_level,user_specs,rating,review_date,verified,review_color,review_color_img,review_title,review_content,no_helpful,no_not_helpful,recommendation
blush,NARS,NARS Liquid Blush,shweta15,Rouge,Rookie,"['Eye Color Brown', 'Hair color Black', 'Skin Tone Deep', 'Skin Type Oily']",5 stars,22 Nov 2019,no,Color: Orgasm,https://www.sephora.com/productimages/sku/s1943331+sw.jpg,the best!,This is the only blush I will ever use. I have super oily skin and this makes it look like a natural glow. I dont even have to use a highlighter. Looks very natural on my tan skin.,0,0,Recommends this product
blush,NARS,NARS Liquid Blush,EEElana,Insider,Rookie,"['Eye Color Hazel', 'Hair color Brunette', 'Skin Tone Fair', 'Skin Type Combination']",2 stars,17 Nov 2019,no,Color: Orgasm,https://www.sephora.com/productimages/sku/s1943331+sw.jpg,Terrible packaging,"Ugh, I've had this for a year and have barely used it because the packaging was so annoying. I didn't understand why there was just a tiny dipstick applicator. Only now as I was reading reviews did I learn it's because the pump is stuck up in the cap! How annoying. Like this much better now that it has a pump, although the pump pushes out too much product... as other reviewers have said, a little goes a really long way. Would not repurchase.
…read more",2,1,
blush,NARS,NARS Liquid Blush,halalalala,VIB,Rookie,"['Eye Color Green', 'Hair color Blonde', 'Skin Tone Light', 'Skin Type Dry']",5 stars,16 Nov 2019,no,Color: Dolce Vita,https://www.sephora.com/productimages/sku/s1943307+sw.jpg,,"Blush never stays on my skin but this one stays on most of the day. I blog on two or three large dots on my cheeks and then blend with a sponge. I can blend to make it light or heavy and it lasts a long time, which usually doesn’t happen on my skin. Definitely recommend for others that have a hard time keeping makeup on all day. I originally bought this type of liquid blush because my skin is super dry and this blush didn’t let me down!
…read more",1,0,Recommends this product
blush,NARS,NARS Liquid Blush,LadyJojo321,Insider,Rookie,"['Eye Color Brown', 'Hair color Black', 'Skin Tone Medium', 'Skin Type Normal']",5 stars,16 Nov 2019,no,Color: Orgasm,https://www.sephora.com/productimages/sku/s1943331+sw.jpg,,Love the color. Goes on with very little and color lasts a long time.,0,0,Recommends this product
blush,NARS,NARS Liquid Blush,KimChic1,Rouge,Rookie,"['Age 35-44', 'Eye Color Brown', 'Hair color Brunette', 'Skin Tone Olive', 'Skin Type Normal']",4 stars,15 Nov 2019,no,Color: Torrid,https://www.sephora.com/productimages/sku/s1943323+sw.jpg,"subtle, soft glow","Such a beautiful wash of colour on my medium skin tone. Really light, watery texture but applies well with a brush or damp Beauty blender onto the apples of the cheek. Lovely sheen with no sparkle. There's so much in the bottle that I feel like I'll never run out! Perfect year round.",1,0,Recommends this product
blush,NARS,NARS Liquid Blush,TCKLS,VIB,Rookie,"['Eye Color Blue', 'Hair color Blonde', 'Skin Tone Fair', 'Skin Type Dry']",5 stars,15 Nov 2019,no,Color: Orgasm,https://www.sephora.com/productimages/sku/s1943331+sw.jpg,,"I have a dry face, and very pale. this is great.. used it on lips when i forgot mine at home.. it was great!",0,0,Recommends this product
blush,NARS,NARS Liquid Blush,anjalirosa,Rouge,Rookie,"['Eye Color Hazel', 'Hair color Brunette', 'Skin Tone Olive', 'Skin Type Dry']",3 stars,14 Nov 2019,no,Color: Torrid,https://www.sephora.com/productimages/sku/s1943323+sw.jpg,Not recommended for eyes and lips,"Not a fan. It’s like a tinted oil. I usually use blushes for eyes, cheeks, and lips. This dried me out so much and was blotchy. Maybe use just for the cheeks.",0,2,
blush,NARS,NARS Liquid Blush,NicoleVB,Rouge,Rookie,"['Eye Color Brown', 'Hair color Black', 'Skin Tone Olive', 'Skin Type Oily']",1 star,13 Nov 2019,no,Color: Orgasm,https://www.sephora.com/productimages/sku/s1943331+sw.jpg,,"Terrible mess of a product! Constantly cap comes off and spilling all over the place. Such a waste! Would never buy again just for this reason. Also too pigmented. Another issue that leads to waste. Stick with the powder or if Nars just had better packaging for the liquid, it would be tolerable",3,0,
blush,NARS,NARS Liquid Blush,Elaf1,Insider,Rookie,"['Eye Color Brown', 'Hair color Blonde', 'Skin Tone Fair', 'Skin Type Normal']",1 star,13 Nov 2019,no,Color: Dolce Vita,https://www.sephora.com/productimages/sku/s1943307+sw.jpg,do NOT LAST long.,"Pretty disappointing. I've been debating between this and benetint for a long time now, for a long lasting liquid blush, and this seemed to get more consistent reviews. it DOES NOT last long on my face. It stays on for about 4 hours and then fades, and if i accidentally touch my cheek it very easily wipes off. It's also hard to apply and is very messy. the color is pretty but if you're looking for longevity, STAY AWAY.
…read more",2,0,
blush,NARS,NARS Liquid Blush,alyssacalie,Rouge,Rookie,"['Eye Color Brown', 'Hair color Brunette', 'Skin Tone Medium', 'Skin Type Dry']",3 stars,7 Nov 2019,no,Color: Dolce Vita,https://www.sephora.com/productimages/sku/s1943307+sw.jpg,The Learning curve is real!!!,"Honestly now I love this blush. However this was not always the case. First of all, when I first got it, the top was so stuck I didn’t know it had a pump. About a month in I looked at reviews and realized I don’t have to be turning the top off every time. Stilll, it is extremely hard to use a little bit at a time and I’ve began just pumping onto the finger and then using a dense buffing brush to grab it and to blend on the cheeks. Take the excess on the finger and put on eyes or lips for a monochromatic look. The color is gorgeous on my olive skin and this little bottle is going to last FOREVER at the rate that I portion out the pumps. Great formula, lasts all day and extra works perfectly on the lips.
…read more",1,0,Recommends this product
blush,NARS,NARS Liquid Blush,Jen62478,VIB,Rookie,[],1 star,7 Nov 2019,no,Color: Dolce Vita,https://www.sephora.com/productimages/sku/s1943307+sw.jpg,Dysfunctional packaging - huge mess!,"This blush is not packaged well and caused a huge mess - both caps are dysfunctional and the blush to leaked twice (causing two huge messes) before and I just threw it away...I only had it for a week. Unless it's staying put on a countertop, beware.",5,0,
blush,NARS,NARS Liquid Blush,jojode,Rouge,Rookie,"['Eye Color Brown', 'Hair color Black', 'Skin Tone Deep', 'Skin Type Combination']",5 stars,2 Nov 2019,yes,Color: Dolce Vita,https://www.sephora.com/productimages/sku/s1943307+sw.jpg,Very nice,Very nice color. Buildable effect. Suits my skin tone and color perfectly,0,0,Recommends this product
blush,NARS,NARS Liquid Blush,hearingxcolors,Rouge,Rookie,"['Eye Color Brown', 'Hair color Black', 'Skin Tone Light', 'Skin Type Oily']",2 stars,23 Oct 2019,no,Color: Orgasm,https://www.sephora.com/productimages/sku/s1943331+sw.jpg,"Product is A ; packaging is complete trash, someho","Product itself is great, and the color suits my skin tone perfectly. That's why it gets anything above 1 star. This would get one star otherwise, due to packaging. I have no idea what happened, but at some point the cap decided it didn't want to couple with the glass container anymore. It simply refuses to go on in a manner that actually closes the container. Because of this ridiculous issue, it made an absolutely monstrous mess which was luckily contained in a plastic bag, since I had it on the plane. I thought ""well shoot, maybe the pressure screwed with the formula and it leaked."" Nope! It's the cap. Now I have half a container of this product (which I've used so little of that you couldn't even tell it was used by looking at the liquid level), blush all over the outside of this product and a ton of my other makeup products, and the cap won't even go on so I can close it. This is such an asinine issue for an expensive, famous makeup product to have.
…read more",7,1,
blush,NARS,NARS Liquid Blush,rn98,VIB,Rookie,"['Eye Color Brown', 'Hair color Black', 'Skin Tone Medium', 'Skin Type Combination']",5 stars,21 Oct 2019,no,Color: Dolce Vita,https://www.sephora.com/productimages/sku/s1943307+sw.jpg,LOVE LOVE LOVE,"I absolutley love this product! I was searching for a liquid blush as I dont like to wear too many powdery items and I like a natural look, this is the PERFECT product for that! The finish is wonderful and it looks super natural. Its a little hard to blend with a brush but I use my mini beauty blender and my fingers and it looks lovely! Will definitley stick to this product",0,0,Recommends this product
blush,NARS,NARS Liquid Blush,DainiAj,Insider,Rookie,"['Eye Color Brown', 'Hair color Black', 'Skin Tone Medium', 'Skin Type Combination']",5 stars,18 Oct 2019,no,Color: Orgasm,https://www.sephora.com/productimages/sku/s1943331+sw.jpg,,The best blush ever!! Easy to apply and stays on well.,0,0,Recommends this product
