product_category,brand,product_name,user_id,BIP_level,BIC_level,user_specs,rating,review_date,verified,review_color,review_color_img,review_title,review_content,no_helpful,no_not_helpful,recommendation
blush,NARS,NARS Liquid Blush,obachi,Rouge,Rookie,"['Eye Color Hazel', 'Hair color Gray', 'Skin Tone Medium', 'Skin Type Oily']",5 stars,1 Mar 2020,no,Color: Orgasm,https://www.sephora.com/productimages/sku/s1943331+sw.jpg,A Pretty Alternative To The Solid Blush,"This is a pretty close approximation of the solid version of this blush. On me though, it’s more intense (brighter pink) so I literally only use a touch on each cheek. Due to its intensity, I don’t dispense it using the pump. Instead, I open the bottle to get the right, tiny amount. It has a thin, watery consistency, so it’s easy to use, and to adjust the amount and color. Also because of the intensity, I’m still using the same bottle three years later!
…read more",4,0,Recommends this product
blush,NARS,NARS Liquid Blush,TellySiregar,VIB,Rookie,"['Eye Color Brown', 'Hair color Black', 'Skin Tone Medium', 'Skin Type Dry']",2 stars,26 Feb 2020,no,Color: Orgasm,https://www.sephora.com/productimages/sku/s1943331+sw.jpg,Where’s the colour?,The colour didn’t show up at all on my cheeks. I applied it with fingers and brush still no good result.,1,1,
blush,NARS,NARS Liquid Blush,Annii12,Rouge,Rookie,"['Eye Color Hazel', 'Hair color Blonde', 'Skin Tone Light', 'Skin Type Dry']",5 stars,24 Feb 2020,no,Color: Torrid,https://www.sephora.com/productimages/sku/s1943323+sw.jpg,Love It!,"I love this liquid blush! It can be scary working with liquid blushes especially since you don't want to end up looking like a clown, but this product really gives you the perfect rosy cheek! One pump is more than enough! Id even suggest using half a pump since a little bit is all you need, I like to apply this blush first and then go over it with my foundation, this way it gives me a more subtle look. This works so well with a beauty sponge and really gives you a pretty finish!
…read more",4,0,Recommends this product
blush,NARS,NARS Liquid Blush,DutchessDani,Rouge,Rookie,"['Eye Color Green', 'Hair color Auburn', 'Skin Tone Light', 'Skin Type Combination']",5 stars,24 Feb 2020,no,Color: Orgasm,https://www.sephora.com/productimages/sku/s1943331+sw.jpg,,Best investment - use Orgasm which pretty much looks good on everyone.... you only use a very small amount. I occasionally use a little powdered blush in the evenings for more drama.... stays on all day with or without powder blush... make it sheer or heavy completely versatile,0,0,Recommends this product
blush,NARS,NARS Liquid Blush,Blackdazzle,VIB,Rookie,"['Eye Color Brown', 'Hair color Black', 'Skin Tone Dark', 'Skin Type Combination']",4 stars,22 Feb 2020,no,Color: Dolce Vita,https://www.sephora.com/productimages/sku/s1943307+sw.jpg,Pretty but not for me ☹️,"I bought this because a lot of darker skin girls on YouTube reviewed it and they said good things about it. Overall it’s really nice, easy to apply. The only down side for me was I just could not see it on my cheeks from the pictures I took. It also didn’t last so long maybe about 4 hrs and it’s faded out. I love being able to see my blush I don’t use a lot of makeup so the blush for me is just like a pop of color for my face. So I’m giving it 4 stars it’s really pretty so I would recommend it. I wish it was more pigmented or maybe that’s not the issue, because I did pack it on but I just didn’t think it lasted that long. I really love the color. I love Nars products so I might purchase some other Nars blush but I had to return this because for $40 I didn’t think it was worth keeping as I don’t have that many blushes so I wanted to buy something I would be able to use more.
…read more",2,1,Recommends this product
blush,NARS,NARS Liquid Blush,604Diana,Insider,Rookie,"['Eye Color Brown', 'Hair color Black', 'Skin Tone Medium', 'Skin Type Combination']",4 stars,17 Feb 2020,no,Color: Dolce Vita,https://www.sephora.com/productimages/sku/s1943307+sw.jpg,Love this blush!,"I love the Dolce Vita color, it looks amazing. I gave it one star less because sometimes it doesn't go on even because it is a liquid but the finished look is nice.",4,0,Recommends this product
blush,NARS,NARS Liquid Blush,Ang1212,VIB,Rookie,"['Eye Color Blue', 'Hair color Blonde', 'Skin Tone Fair', 'Skin Type Combination']",5 stars,17 Feb 2020,no,Color: Orgasm,https://www.sephora.com/productimages/sku/s1943331+sw.jpg,,"First time using a liquid blush and I will never go back to a powder. Easy to apply, lasts all day and you only need a very small amount, so the product lasts a long time. I’ve never had a problem with the bottle leaking. I’ve even traveled with it by air and no issues.",14,0,Recommends this product
blush,NARS,NARS Liquid Blush,mechengg,Rouge,Rookie,"['Age over 54', 'Eye Color Brown', 'Hair color Black', 'Skin Tone Medium', 'Skin Type Combination']",4 stars,14 Feb 2020,no,Color: Orgasm,https://www.sephora.com/productimages/sku/s1943331+sw.jpg,subtle and efficient,"on my NC30 skin tone, this blush shows up very subtly. I actually quite like this natural flushed look so i don't bother using more than a tiny drop for both cheeks. This bottle will last me a couple of years if it doesn't dry up first. I shake before applying as it does settle at the bottom. The color is beautiful but does not look completely natural on my cheeks due to the peachy undertone to it. When I go out at night, I apply a shimmery powder blush on top to intensity and it looks stunning.
…read more",11,0,Recommends this product
blush,NARS,NARS Liquid Blush,lowgirl,VIB,Rookie,"['Eye Color Green', 'Hair color Brunette', 'Skin Tone Light', 'Skin Type Combination']",5 stars,13 Feb 2020,yes,Color: Orgasm,https://www.sephora.com/productimages/sku/s1943331+sw.jpg,"Nice color ,wears good","Just the right pink peach color ,wears good ,want to get more colors I like it so well",1,0,Recommends this product
blush,NARS,NARS Liquid Blush,Pawpina,VIB,Rookie,"['Eye Color Brown', 'Hair color Brunette', 'Skin Tone Medium', 'Skin Type Combination']",2 stars,12 Feb 2020,no,Color: Orgasm,https://www.sephora.com/productimages/sku/s1943331+sw.jpg,Disappointed.,"I wanted to love this product. The color is beautiful and build-able, easily glides on.. I often tapped on with a finger and blended with a beauty blender. I am returning because of the packaging. Even when used conscientiously, the bottle cap and top combo are a disaster. Prone to becoming loose, even when you are using it correctly and NOT TWISTING the cap off. Transported overnight and awoke to the liquid blush ALL over the inside of my make up bag and all over every other product. I hope Nars redesigns soon.
…read more",20,0,
blush,NARS,NARS Liquid Blush,Shera215,Rouge,Rookie,"['Eye Color Gray', 'Hair color Black', 'Skin Tone Olive', 'Skin Type Combination']",4 stars,11 Feb 2020,yes,Color: Dolce Vita,https://www.sephora.com/productimages/sku/s1943307+sw.jpg,,This product has a lovely color pay off and a little goes a long way . My interest was peaked by Jacki Aina in one of her videos . I am shade 345 in Fenty and Tahoe in Nars and this shade gives me the perfect blush look I am looking for .,5,1,Recommends this product
blush,NARS,NARS Liquid Blush,GUIMEI,Rouge,Rookie,"['Eye Color Brown', 'Hair color Brunette', 'Skin Tone Light', 'Skin Type Dry']",5 stars,9 Feb 2020,no,Color: Orgasm,https://www.sephora.com/productimages/sku/s1943331+sw.jpg,holy grail for dry skin!!,"holy grail for dry skin!!!! Love the colour and the texture. Blush sits really well, easy to blend and looks super natural. Just wished it lasted a bit longer, nonetheless, ❤️❤️❤️❤️ Dont think I can go back to powder blushes again",4,0,Recommends this product
blush,NARS,NARS Liquid Blush,ohchelley,Rouge,Rookie,"['Skin Tone Dark', 'Skin Type Normal']",2 stars,8 Feb 2020,yes,Color: Torrid,https://www.sephora.com/productimages/sku/s1943323+sw.jpg,,I love this so much. It’s really pigmented so a little goes a lonnnggg way. The shimmer in it is very subtle so you get that glow from within effect. Apply with fingers is best. Brushes and this separate my foundation,2,2,Recommends this product
blush,NARS,NARS Liquid Blush,Wog500,Insider,Rookie,"['Eye Color Brown', 'Hair color Brunette', 'Skin Tone Fair', 'Skin Type Dry']",3 stars,7 Feb 2020,no,Color: Dolce Vita,https://www.sephora.com/productimages/sku/s1943307+sw.jpg,Beautiful but messy,"Love the color and the sheen, glowy look it gives me but a little goes a long way and it can be quite messy. Is not very mobile. In fact, the bottle leaks a bit so be careful with it.",4,0,Recommends this product
blush,NARS,NARS Liquid Blush,skingcullman,VIB,Rookie,"['Eye Color Blue', 'Hair color Blonde', 'Skin Tone Porcelain', 'Skin Type Combination']",3 stars,4 Feb 2020,no,Color: Orgasm,https://www.sephora.com/productimages/sku/s1943331+sw.jpg,good product. bad design.,"I love this product. But it leaks so badly. I’ve probably lost over half of the liquid due to it not sealing. I even store this sitting straight up, but somehow it all comes out of the top.",7,0,
blush,NARS,NARS Liquid Blush,KaitlynMacM,Insider,Rookie,"['Eye Color Blue', 'Hair color Blonde', 'Skin Tone Light', 'Skin Type Combination']",3 stars,31 Jan 2020,yes,Color: Orgasm,https://www.sephora.com/productimages/sku/s1943331+sw.jpg,,A little goes a long way and the colour is absolutely stunning. It’s the perfect pink and has a subtle sheen. This is my new favourite blush. I just don’t love the dropper or the cap.,3,0,Recommends this product
blush,NARS,NARS Liquid Blush,donabmua,Rouge,Rookie,"['Eye Color Hazel', 'Hair color Brunette', 'Skin Tone Fair', 'Skin Type Combination']",3 stars,27 Jan 2020,no,Color: Orgasm,https://www.sephora.com/productimages/sku/s1943331+sw.jpg,,"I’m only giving this 3 stars because of the cap! It’s the worst and doesn’t screw or stay on. Other than that, the formula is vibrant and pigmented and a little goes a long way!",4,2,
blush,NARS,NARS Liquid Blush,ReeseBo,Rouge,Rookie,"['Eye Color Brown', 'Hair color Black', 'Skin Tone Medium', 'Skin Type Combination']",5 stars,26 Jan 2020,no,Color: Orgasm,https://www.sephora.com/productimages/sku/s1943331+sw.jpg,little but mighty,I really like this product! I’ve been trying to switch my makeup from powders to more creams and liquids. Obviously one of the first things I did was change to liquid blush. The product is really pigmented and easy to build on top of it! So a little goes a long way. It doesn’t make me break out either! It’s a tiny bottle but there’s a lot in it! You don’t need to use a lot.,5,0,Recommends this product
blush,NARS,NARS Liquid Blush,vivibi,Rouge,Rookie,"['Eye Color Brown', 'Hair color Black', 'Skin Tone Fair', 'Skin Type Dry']",3 stars,22 Jan 2020,no,Color: Torrid,https://www.sephora.com/productimages/sku/s1943323+sw.jpg,,I love the colour. Healthy and shiny. But it is just so hard to apply the right amount.,1,0,
blush,NARS,NARS Liquid Blush,GlassAlice,Rouge,Rookie,"['Eye Color Blue', 'Hair color Red', 'Skin Tone Fair', 'Skin Type Combination']",4 stars,21 Jan 2020,yes,Color: Orgasm,https://www.sephora.com/productimages/sku/s1943331+sw.jpg,"Weightless, and enough to last forever","I love that this is weightless and sheer, and flat like a powder can be. A tiny dot goes a long way, so start tiny, you can always build on. I feel like this jar is going to last forever, so while it is expensive, it is also not something you are going to have to repurchase any time soon. I tried this in torrid because I'm hesitant about things that are too pinky, but ultimately, this pink is very wearable and though it looks a little candy pink in the container, looks more like a sweet little flush on your cheek.
…read more",13,1,Recommends this product
blush,NARS,NARS Liquid Blush,Shelby1796,Rouge,Rookie,"['Eye Color Brown', 'Hair color Brunette', 'Skin Tone Light', 'Skin Type Combination']",5 stars,20 Jan 2020,no,Color: Orgasm,https://www.sephora.com/productimages/sku/s1943331+sw.jpg,Goodbye bad skin days!,"I adore this blush! Even if I’m having a bad foundation day, the second I apply this my skin instantly looks radiant, natural, and alive. Plus, it stays put allll day. A little goes a very long way, so proceed with caution. But if applied correctly it can elevate you to a whole new level of beautiful!",6,2,Recommends this product
blush,NARS,NARS Liquid Blush,SaintArtemis,VIB,Rookie,"['Eye Color Brown', 'Hair color Black', 'Skin Tone Medium', 'Skin Type Oily']",5 stars,20 Jan 2020,no,Color: Dolce Vita,https://www.sephora.com/productimages/sku/s1943307+sw.jpg,Color me pink.,"Alittle goes a LONG way. I would recommend using a damp sponge or your fingers for a smooth natural flushed look. It lasts all day, I work in a hospital and it lasts all 8 hours without fading.",4,0,Recommends this product
blush,NARS,NARS Liquid Blush,mandana,Rouge,Rookie,"['Age 25-34', 'Eye Color Brown', 'Hair color Brunette', 'Skin Tone Olive', 'Skin Type Oily']",5 stars,18 Jan 2020,no,Color: Torrid,https://www.sephora.com/productimages/sku/s1943323+sw.jpg,beautiful shade,love this blush and this shade. I have been using cream blush for a few years now and have never wanted to go back to powdered blush!,2,0,Recommends this product
blush,NARS,NARS Liquid Blush,MMPixie,Insider,Rookie,"['Eye Color Blue', 'Hair color Blonde', 'Skin Tone Fair', 'Skin Type Dry']",4 stars,18 Jan 2020,yes,Color: Orgasm,https://www.sephora.com/productimages/sku/s1943331+sw.jpg,,"Great color, but still learning how to apply this product ever so gingerly. It will probably last me 5 years as a very tiny bit goes a long way.",2,2,Recommends this product
blush,NARS,NARS Liquid Blush,vin16mc,Rouge,Rookie,"['Eye Color Brown', 'Hair color Black', 'Skin Tone Tan', 'Skin Type Oily']",5 stars,18 Jan 2020,no,Color: Orgasm,https://www.sephora.com/productimages/sku/s1943331+sw.jpg,So much pigment!,"I never thought I would use liquid blush and then I swatched this in the store and I was shook. I like the original powder blush in Orgasm and to my surprise, I like the liquid version even more. A little goes a long way with this product, and can easily be blended with clean fingertips. The formula is long-wearing and highly pigmented. I would definitely like to try the other shades in this formula.",0,0,Recommends this product
blush,NARS,NARS Liquid Blush,Jabby2012,Rouge,Rookie,"['Eye Color Green', 'Hair color Brunette', 'Skin Tone Light', 'Skin Type Dry']",2 stars,17 Jan 2020,no,Color: Orgasm,https://www.sephora.com/productimages/sku/s1943331+sw.jpg,Pretty Good / Awful packaging,"I purchased both Orgasm and Torrid and found that both colours suited my light complexion. I had some issues with application as in deciding the best way to apply. I finally settled on using a brush because finger application didn't produce an even wash of colour, I just ended up with blotches of colour on my cheeks. Three stars taken away because of the terrible packaging. So much product was wasted because the pump dispenses with barely any pressure, using an index finger to pump, you end up with three times the amount of product that you actually need. The lids of both bottles never stayed on and when they constantly fell off in my makeup bag, the pump would hit something like a makeup brush or an eyeshadow pallet and liquid would end up all over the inside of my makeup bag. It was a mess! You would think for the cost of this item NARS could at least invest in some quality packaging, not the cheap bottles these liquid blushes come in. I wouldn't purchase again unless the packaging changed. Washing my makeup bag and cleaning every item in that bag, over and over, got old, fast.
…read more",7,1,Recommends this product
blush,NARS,NARS Liquid Blush,angie116,VIB,Rookie,"['Eye Color Hazel', 'Hair color Brunette', 'Skin Tone Medium', 'Skin Type Oily']",5 stars,15 Jan 2020,no,Color: Orgasm,https://www.sephora.com/productimages/sku/s1943331+sw.jpg,Love love love,"This is my favorite blush I’ve ever used and over 6 months after buying my first bottle I’m back now to buy my second. A little goes a long way, truly. I too had the same issue with the cap.",0,2,Recommends this product
blush,NARS,NARS Liquid Blush,spagirl4,VIB,Rookie,"['Eye Color Blue', 'Hair color Blonde', 'Skin Tone Light', 'Skin Type Normal']",5 stars,13 Jan 2020,no,Color: Orgasm,https://www.sephora.com/productimages/sku/s1943331+sw.jpg,Blush obsession,I’ve been using the orgasm blush for forever so I had to try the liquid blush when it came out. I had very little expectations but holy wow! I love how soft and dewy it looks on my skin. I’ve bought 2 bottle already and don’t think I’ll go back to the normal blush. My new fav!!,1,0,Recommends this product
blush,NARS,NARS Liquid Blush,elledc,VIB,Rookie,"['Eye Color Blue', 'Hair color Black', 'Skin Tone Fair', 'Skin Type Dry']",1 star,11 Jan 2020,no,Color: Orgasm,https://www.sephora.com/productimages/sku/s1943331+sw.jpg,FRUSTRATION,"I am so over NARS blushes. First I bought the pressed powder blush and it got a weird film over it after a few uses. I had to regularly scrape off a layer to get to the actual powder. So, I threw it out and bought this. WORST packaging ever. It's like they have never used a liquid product before - frustration EVERY DAY. It gets everywhere and is a hot mess. I eventually poured it out into a regular bottle with a normal top, and I'm using it that way. But you know, there are alternatives, and I'm done with NARS.
…read more",15,3,
blush,NARS,NARS Liquid Blush,lavieoceanique,Rouge,Rookie,"['Eye Color Brown', 'Hair color Brunette', 'Skin Tone Medium', 'Skin Type Dry']",5 stars,7 Jan 2020,no,Color: Torrid,https://www.sephora.com/productimages/sku/s1943323+sw.jpg,so beautiful but application is tricky,"I love liquid and créme blushes and NARS always give you a lot of product for the money. When I apply this with my fingers or a sponge it always messes up my foundation. I’ve found the best method is to put a tiny drop on the back of your hand then pick up most the product with a fluffy but small synthetic brush like the colourpop f5. The brush has to be pretty saturated. Then you barely skim and feather the product on your cheeks. The finished effect is so stunning and skin-like and it’s very easy to layer for stronger flushed look. NARS, please make these in more shades! Like Lovejoy or Madly?!? PS Torrid is the perfect sunburn color for medium to tan olive skin tones!
…read more",5,0,Recommends this product
blush,NARS,NARS Liquid Blush,janaleemcC,Rouge,Rookie,"['Eye Color Hazel', 'Hair color Brunette', 'Skin Tone Medium', 'Skin Type Combination']",2 stars,4 Jan 2020,yes,Color: Orgasm,https://www.sephora.com/productimages/sku/s1943331+sw.jpg,They changed the product color & consistency:(,"Decent blush but not the same color as previous orgasm NARS products. The gold highlight aspect of the color is gone. They also changed the consistency from a nice gel to watery liquid. Very disappointed. Also, had packaging problems with the cap getting stuck on the pump and lost a lot of product in the process of fixing it. Used to love the orgasm liquid illuminator please bring it back :(",4,0,
blush,NARS,NARS Liquid Blush,GEbunny,Rouge,Rookie,"['Eye Color Brown', 'Hair color Brunette', 'Skin Tone Light', 'Skin Type Combination']",5 stars,3 Jan 2020,yes,Color: Torrid,https://www.sephora.com/productimages/sku/s1943323+sw.jpg,Love at First Use.,I’ve only use it a few times and I’m in love. A little goes a long way. I didn’t realize at first that it’s a pump and twisted it off lol so just be careful because it could get messy. I use one dot for each cheek and it’s more than enough. Should last me a while.,0,0,Recommends this product
blush,NARS,NARS Liquid Blush,tortor8273,Rouge,Rookie,"['Eye Color Blue', 'Hair color Blonde', 'Skin Tone Light', 'Skin Type Dry']",5 stars,3 Jan 2020,no,Color: Torrid,https://www.sephora.com/productimages/sku/s1943323+sw.jpg,"amazing, but theres a learning curve","the perfect ""I spent the day in the sun and now I have the perfect glow"" shade! my holy grail. I have very dry skin and this did not cling to any dry patches, it just made me look healthy! I wish Nars would come out with a bronzer and/or contour in this formula! Only issue is its incredibly pigmented so I put a half a pump on a makeup palette (I actually use a mason jar lid cause I'm cheap) and tap it into my beauty blender, then once its absorbed I tap it a few more times to distribute the product better before I put it on my cheeks. I would also recommend using a separate makeup sponge dedicated to this blush as its incredibly pigmented and if you dont wash it out reaaaally well after every single use it could easily mess up your foundation if you use the same sponge for it
…read more",0,0,Recommends this product
blush,NARS,NARS Liquid Blush,Winnie6,Rouge,Rookie,"['Eye Color Gray', 'Hair color Blonde', 'Skin Tone Fair', 'Skin Type Dry']",3 stars,2 Jan 2020,yes,Color: Orgasm,https://www.sephora.com/productimages/sku/s1943331+sw.jpg,Good product but dispenser and cap are awful,No issue with what’s in the bottle but the dispenser gives ways too much blush. Ends up being washed down the sink. Screw top cap takes several tries to get closed.,1,0,
blush,NARS,NARS Liquid Blush,JanetGC,VIB,Rookie,"['Eye Color Blue', 'Hair color Blonde', 'Skin Tone Fair', 'Skin Type Combination']",2 stars,30 Dec 2019,no,Color: Orgasm,https://www.sephora.com/productimages/sku/s1943331+sw.jpg,Terrible Applicator / Lovely Formula,"LOVED the formula - was smooth and beautiful, but HATED the applicator, which is not intuitive and immediately broke and rendered useless. I tried to continue using it but it was a terrible mess. See pix. Nars, please repackage so it's easier to use.",2,0,
blush,NARS,NARS Liquid Blush,sunnybee,Rouge,Rookie,"['Eye Color Hazel', 'Hair color Blonde', 'Skin Tone Fair', 'Skin Type Combination']",5 stars,29 Dec 2019,no,Color: Orgasm,https://www.sephora.com/productimages/sku/s1943331+sw.jpg,,Beautiful. Stays on all day and seems to come from within. Haven't found another blush that measures up!,2,0,Recommends this product
blush,NARS,NARS Liquid Blush,cheriiberry,VIB,Rookie,"['Age 18-24', 'Eye Color Brown', 'Hair color Brunette', 'Skin Tone Tan', 'Skin Type Combination']",5 stars,27 Dec 2019,no,Color: Dolce Vita,https://www.sephora.com/productimages/sku/s1943307+sw.jpg,Next level NARS :),"i love this blush it really takes my makeup routine to the next level. Blush usually wears off quickly on me but adding this under a light wash of powder blush really does wonders for me. Like many others, I twisted off the cap.. i actually had this blush for months before realizing it was a pump design lol. WARNING: a little goes a very very long way!! you barely need half a pump for both cheeks. I normally apply mine with a fluffy buffing brush and i get a very nice finish.
…read more",1,0,Recommends this product
blush,NARS,NARS Liquid Blush,meronlamouche,VIB,Rookie,"['Eye Color Brown', 'Hair color Brunette', 'Skin Tone Porcelain', 'Skin Type Normal']",3 stars,23 Dec 2019,yes,Color: Orgasm,https://www.sephora.com/productimages/sku/s1943331+sw.jpg,I need help,I just bought the product and I love it but I am having a hard time with closing the bottle. Is this normal and tehre's a trick to it or didi I just get a broken bottle. please help.,0,0,Recommends this product
blush,NARS,NARS Liquid Blush,,,,"['Eye Color Blue', 'Hair color Brunette', 'Skin Tone Light', 'Skin Type Combination']",3 stars,13 Dec 2019,no,Color: Orgasm,https://www.sephora.com/productimages/sku/s1943331+sw.jpg,"5 star product, 1 star packaging",I love the blush itself - the color works for me (I don’t think it works for everyone) and I love how subtle it can go on but its buildable for a more dramatic look - but I really don’t like the packaging. It took me a week to realize there was actually a pump and I just had to pull rather than twist.,0,0,Recommends this product
blush,NARS,NARS Liquid Blush,looders,VIB,Rookie,"['Eye Color Green', 'Hair color Blonde', 'Skin Tone Light', 'Skin Type Dry']",5 stars,10 Dec 2019,no,Color: Orgasm,https://www.sephora.com/productimages/sku/s1943331+sw.jpg,,Beautiful color. You only need a tiny drop for each cheek!,0,0,Recommends this product
blush,NARS,NARS Liquid Blush,egret8,Insider,Rookie,"['Eye Color Green', 'Hair color Blonde', 'Skin Tone Medium', 'Skin Type Combination']",5 stars,10 Dec 2019,no,Color: Dolce Vita,https://www.sephora.com/productimages/sku/s1943307+sw.jpg,,this gives a nice glow- have to be a little careful applying it but overall I like it,0,0,Recommends this product
blush,NARS,NARS Liquid Blush,kylethegirl,VIB,Rookie,"['Age over 54', 'Eye Color Brown', 'Hair color Brunette', 'Skin Tone Light', 'Skin Type Normal']",3 stars,10 Dec 2019,yes,Color: Dolce Vita,https://www.sephora.com/productimages/sku/s1943307+sw.jpg,Hard to figure out the amount to put on,"The color is pretty but it's hard to control the amount. It goes on really dark and I think I put on too much, then it fades to almost nothing.",1,0,Recommends this product
blush,NARS,NARS Liquid Blush,Emmikke,Insider,Rookie,"['Eye Color Brown', 'Hair color Brunette', 'Skin Tone Medium', 'Skin Type Combination']",1 star,26 Nov 2019,no,Color: Orgasm,https://www.sephora.com/productimages/sku/s1943331+sw.jpg,Bottle will break and you'll lose a lot of product,The applicator broke immediately after I bought this product. It ended up being that I couldn't close the bottle and one day it eventually spilled and stained my clothes and bathroom floor. This would never have happened if the applicator didn't break.,0,0,
