product_category,brand,product_name,user_id,BIP_level,BIC_level,user_specs,rating,review_date,verified,review_color,review_color_img,review_title,review_content,no_helpful,no_not_helpful,recommendation
blush,NARS,NARS Liquid Blush,justpeachy1781,Rouge,Rookie,"['Eye Color Brown', 'Hair color Brunette', 'Skin Tone Light', 'Skin Type Combination']",4 stars,46 m ago,yes,Color: Dolce Vita,https://www.sephora.com/productimages/sku/s1943307+sw.jpg,Fantastic but be careful with application,Love the colour and it’s staying power but be careful when applying! I made the mistake of putting on too much product the first time and I spent ages trying to blend it in,0,0,Recommends this product
blush,NARS,NARS Liquid Blush,annanicoledg,Rouge,Rookie,"['Eye Color Hazel', 'Hair color Blonde', 'Skin Tone Medium', 'Skin Type Dry']",4 stars,19 h ago,yes,Color: Orgasm,https://www.sephora.com/productimages/sku/s1943331+sw.jpg,So Pretty!,"I usually am not a fan of liquid blush but saw this look amazing on so many people I had to pick it up. I love the colour and it applies amazing without lifting makeup. It is veryyyyyy glittery and sparkly in day light but more natural and toned down in artificial lighting, so I prefer it more for in door events lol!",0,0,Recommends this product
blush,NARS,NARS Liquid Blush,Kissanya,VIB,Rookie,"['Eye Color Brown', 'Hair color Blonde', 'Skin Tone Olive', 'Skin Type Normal']",2 stars,3 d ago,no,Color: Dolce Vita,https://www.sephora.com/productimages/sku/s1943307+sw.jpg,Weird product in every sense,"So disappointed! The product has a weird tip less applicator the lid doesn’t tighten all the way and it’s really a spill hazard that ends up getting so mucky. I find it really pigmented and not that easy to blend. I’ll use the smallest drop and even then it doesn’t blend well and looks blotchy. So much work, so much haste not worth it at all!",0,1,
blush,NARS,NARS Liquid Blush,nicoledcamp,VIB,Rookie,"['Eye Color Hazel', 'Hair color Brunette', 'Skin Tone Medium', 'Skin Type Dry']",3 stars,6 d ago,yes,Color: Torrid,https://www.sephora.com/productimages/sku/s1943323+sw.jpg,Good product. Lousy packaging unfortunately.,"Good product but terrible packaging. From photos and videos I’ve seen of the product, it looks like it comes as a pump to apply but instead I received a screw off lid with no applicator, that I almost spilled completely when I opened for the first time. The top does not screw on very securely and it looks like it’s missing any type of applicator as if it were a sample in store. Very messy on the sides of bottle because so much product comes out at once. If this had come as a pump as it is shown then would have rated this 5 stars but as is, I think I will have to return.
…read more",0,0,
blush,NARS,NARS Liquid Blush,spicybruschetta,Insider,Rookie,"['Eye Color Hazel', 'Hair color Brunette', 'Skin Tone Olive', 'Skin Type Combination']",5 stars,9 d ago,no,Color: Orgasm,https://www.sephora.com/productimages/sku/s1943331+sw.jpg,All Day Glow,"So, you take the cult classic favourite Orgasm colour and make it a buildable liquid? Done. Sold. I love this and it gives me a beautiful natural blush that lasts ALL DAY. Plus, despite wearing daily, I’m still working on my first bottle about a full year after purchase. It’s so pigmented, you need so little, it lasts forever!",1,0,Recommends this product
blush,NARS,NARS Liquid Blush,melissa355,Rouge,Rookie,"['Eye Color Brown', 'Hair color Black', 'Skin Tone Light', 'Skin Type Combination']",5 stars,10 d ago,yes,Color: Orgasm,https://www.sephora.com/productimages/sku/s1943331+sw.jpg,A little goes a long way :),Amazing pigment! Worth the money for the amount of product you get and for how pigmented it is. A little does go a long way so I only use 1/3 of a pump to achieve a sheer pinky glow to my checks and it blends very nicely over foundation. This product will definitely last me a very long time.,1,0,Recommends this product
blush,NARS,NARS Liquid Blush,joannamab012916,Rouge,Rookie,"['Age 25-34', 'Eye Color Brown', 'Hair color Black', 'Skin Tone Medium', 'Skin Type Combination']",5 stars,11 d ago,no,Color: Orgasm,https://www.sephora.com/productimages/sku/s1943331+sw.jpg,Perfect liquid blush!,This one last all day. I used it on my cousin on her wedding. It looks so pretty when I look through her wedding photos. I like this better than the regular orgasm pressed blush on.,1,0,Recommends this product
blush,NARS,NARS Liquid Blush,Chriniki,VIB,Rookie,"['Eye Color Green', 'Hair color Brunette', 'Skin Tone Fair', 'Skin Type Normal']",5 stars,19 d ago,yes,Color: Orgasm,https://www.sephora.com/productimages/sku/s1943331+sw.jpg,Beautiful color,"I love this! The color is really flattering and it's so easy to use. What I will say is that it looks like a small pot but a little goes a long way, so it should last ages. I find it much easier to blend than traditional blush and it's my new favorite!",1,0,Recommends this product
blush,NARS,NARS Liquid Blush,TalitaVz,Rouge,Rookie,"['Age 35-44', 'Eye Color Brown', 'Hair color Auburn', 'Skin Tone Fair', 'Skin Type Normal']",5 stars,21 d ago,no,Color: Dolce Vita,https://www.sephora.com/productimages/sku/s1943307+sw.jpg,,"Beautiful blush. It's pretty much a natural healthy colour for you. So pigmented (it's gonna last forever) just a tiny drop for both cheeks. I applied with my fingers, but you also can use it with beauty sponge.",4,0,Recommends this product
blush,NARS,NARS Liquid Blush,deegabby,Insider,Rookie,"['Eye Color Brown', 'Hair color Brunette', 'Skin Tone Fair', 'Skin Type Combination']",5 stars,23 d ago,yes,Color: Orgasm,https://www.sephora.com/productimages/sku/s1943331+sw.jpg,,"i was a little hesitant because i don’t wear blush and never have, but i figured this would be easier to work with as a beginner and OH. MY. GOODNESS. it’s so beautiful on the skin!!! i put the smallest drop on the back of my hand, use my middle finger and rub it out then pat and blend onto my face. the prettiest color ever! my boyfriend even noticed and said he thought i looked younger. i definitely recommend! i even ordered torrid after i played with orgasm for about two weeks!
…read more",4,1,Recommends this product
blush,NARS,NARS Liquid Blush,Nadas10,VIB,Rookie,"['Eye Color Brown', 'Hair color Brunette', 'Skin Tone Light', 'Skin Type Normal']",3 stars,23 d ago,no,Color: Torrid,https://www.sephora.com/productimages/sku/s1943323+sw.jpg,cutee,It’s a very subtle blush. I loved it but wasn’t head over heels for it. It’s nice for a no makeup makeup look.,0,0,Recommends this product
blush,NARS,NARS Liquid Blush,jillibean587,VIB,Rookie,"['Eye Color Blue', 'Hair color Brunette', 'Skin Tone Fair', 'Skin Type Normal']",5 stars,25 d ago,no,Color: Dolce Vita,https://www.sephora.com/productimages/sku/s1943307+sw.jpg,worth it,Amazing! I have never had a blush that lasts all day. I put this on at 7am and it is the only makeup still on my face at 630pm when I get home from work. Even days after wearing a face mask all day! It looks untouched. I’ve gotten so many compliments. I’m buying in other colors,2,0,Recommends this product
blush,NARS,NARS Liquid Blush,alexxmp,Rouge,Rookie,"['Eye Color Brown', 'Hair color Brunette', 'Skin Tone Medium', 'Skin Type Normal']",5 stars,25 d ago,yes,Color: Dolce Vita,https://www.sephora.com/productimages/sku/s1943307+sw.jpg,Easy to use,"Beautiful color, much brighter on the face than it looks in the bottle. Blends very nicely using fingers, no patchiness. A little goes a very long way, though.",0,0,Recommends this product
blush,NARS,NARS Liquid Blush,brielise,VIB,Rookie,"['Eye Color Brown', 'Hair color Blonde', 'Skin Tone Medium', 'Skin Type Oily']",5 stars,29 d ago,no,Color: Orgasm,https://www.sephora.com/productimages/sku/s1943331+sw.jpg,,amazing summer glow! gives my no make up look life,0,0,Recommends this product
blush,NARS,NARS Liquid Blush,Tina527,Insider,Rookie,"['Eye Color Brown', 'Hair color Brunette', 'Skin Type Combination']",5 stars,3 May 2020,no,Color: Orgasm,https://www.sephora.com/productimages/sku/s1943331+sw.jpg,The key to a healthy and natural glow,It's perfection; a little goes a very long way; half a pump is enough to dab on my eyelids along with my cheeks for a very natural look. I can't even tell you all the complements that I've received since I started using it.,2,0,Recommends this product
blush,NARS,NARS Liquid Blush,andreaji,VIB,Rookie,"['Eye Color Brown', 'Hair color Black', 'Skin Tone Deep', 'Skin Type Combination']",3 stars,2 May 2020,no,Color: Dolce Vita,https://www.sephora.com/productimages/sku/s1943307+sw.jpg,Not user friendly,"Good color, I also use it to stain the lip. My biggest issue is that it is prone to spill or stain my counter, mirror or anything around me. Basically not very user friendly",5,0,
blush,NARS,NARS Liquid Blush,jmhb13,Rouge,Rookie,"['Eye Color Blue', 'Hair color Brunette', 'Skin Tone Fair', 'Skin Type Dry']",4 stars,30 Apr 2020,no,Color: Orgasm,https://www.sephora.com/productimages/sku/s1943331+sw.jpg,,"I loved this product, but I recommend it only when absolutely necessary. I live in Texas and the hot summers mean that most blush doesn't last past the walk to my car in the morning. The liquid blush is the first I have found that will hold up to the heat and last the majority of the day. A little definitely goes a long way; I use only half a pump or less for both cheeks, and even then I have to blend it out significantly on my hand before applying it. It has a longer dry down time as well, so I have to avoid touching my face or using other products for a few minutes after applying. While I love the color and staying power, the complicated application process is not always worth it. I really only reach for this product if I know I will not be able to reapply my blush at a later point in the day.
…read more",6,2,Recommends this product
blush,NARS,NARS Liquid Blush,AmieF07,,,"['Eye Color Green', 'Hair color Brunette', 'Skin Tone Fair', 'Skin Type Combination']",3 stars,28 Apr 2020,no,Color: Torrid,https://www.sephora.com/productimages/sku/s1943323+sw.jpg,"Great product, horrible packaging","This blush (in color Torrid; site wouldn’t let me change color) is gorgeous; a little goes a long way and it looks somewhat orangey going on, but blends out to be a gorgeous coral, even on my cool, fair skin. Lovely color for summer to match a more bronzer makeup look. A tiny dab is all I need, and the glow stays for hours. HOWEVER, the packaging is awful. Something about the bottle being square doesn’t allow it to screw closed tightly, and I was devastated to see after having it just a couple of weeks that it spilled all over my makeup drawer recently. That’s an expensive blush to spill for crappy packaging! I should’ve known to store it upright when I noticed the sample bottle in-store had drips all over it. So very disappointed. Proceed with caution and make sure to store this upright and do not travel with it!
…read more",9,2,Recommends this product
blush,NARS,NARS Liquid Blush,aquino03,Insider,Rookie,"['Eye Color Brown', 'Hair color Black', 'Skin Tone Medium', 'Skin Type Normal']",4 stars,27 Apr 2020,no,Color: Dolce Vita,https://www.sephora.com/productimages/sku/s1943307+sw.jpg,Product lasts forever!,"This blush is definitely a high end price but I still haven't run out of product after a long while. This shade is described as a matte dusty rose but I don't find that true because you can see fine shimmer particles on the skin but it looks nice. A little goes a long way since it's very pigmented and it's lasted through very humid and hot weather. I would recommend powdering it for longer staying power but I have been able to wear this throughout all four seasons. There are definitely more affordable liquid blushes that have a great formula as this but this product will last you a very long time. I find it looks best on bare skin or with a little bit of makeup under.
…read more",6,0,Recommends this product
blush,NARS,NARS Liquid Blush,AlexisMatias,Rouge,Rookie,"['Eye Color Brown', 'Hair color Black', 'Skin Tone Medium', 'Skin Type Combination']",2 stars,23 Apr 2020,no,Color: Orgasm,https://www.sephora.com/productimages/sku/s1943331+sw.jpg,,I bought all the shades. I’m having a hard time blending it. I like the stick better. I just gave it to my sister,3,3,
blush,NARS,NARS Liquid Blush,Minhthach,VIB,Rookie,"['Eye Color Brown', 'Hair color Brunette', 'Skin Tone Medium', 'Skin Type Dry']",5 stars,22 Apr 2020,no,Color: Torrid,https://www.sephora.com/productimages/sku/s1943323+sw.jpg,Desi Perkins sent me here,"I saw a video of Desi Perkins using this, It looked so natural and beautiful on her. The liquid blush is easy to use. A little bit goes a long way.",5,0,Recommends this product
blush,NARS,NARS Liquid Blush,macout,Rouge,Rookie,"['Eye Color Blue', 'Hair color Blonde', 'Skin Tone Porcelain', 'Skin Type Dry']",3 stars,17 Apr 2020,no,Color: Orgasm,https://www.sephora.com/productimages/sku/s1943331+sw.jpg,Extremely pigmented,"not shimmery, I have to go over it with a little fondation just because it's wayyy too pigmented.",4,0,
blush,NARS,NARS Liquid Blush,MargoChanning,VIB,Rookie,"['Eye Color Brown', 'Hair color Black', 'Skin Tone Olive', 'Skin Type Dry']",1 star,16 Apr 2020,yes,Color: Dolce Vita,https://www.sephora.com/productimages/sku/s1943307+sw.jpg,Disappointing,"Very disappointed. I bought this because it said it was a matte dusty rose. It’s not. There’s very obvious shimmer which I don’t like. Also, the packaging is messy. Leaks and absolutely do not shakes the bottle without the top on. I made that mistake and it went all over my bathroom.",3,11,
blush,NARS,NARS Liquid Blush,humanjello,,,['Skin Tone Medium'],5 stars,15 Apr 2020,yes,Color: Torrid,https://www.sephora.com/productimages/sku/s1943323+sw.jpg,very nice!,Beautiful formula very nice color. Not shimmery like orgasm but more subtle. Would purchase again.,9,0,Recommends this product
blush,NARS,NARS Liquid Blush,ChristineDancer,Rouge,Rookie,"['Eye Color Blue', 'Hair color Blonde', 'Skin Tone Fair', 'Skin Type Combination']",4 stars,15 Apr 2020,no,Color: Orgasm,https://www.sephora.com/productimages/sku/s1943331+sw.jpg,,I like it better than powder blush. Goes on smooth and lasts longer.,3,0,Recommends this product
blush,NARS,NARS Liquid Blush,Djcbjaowbdusgwi,Insider,Rookie,"['Eye Color Green', 'Hair color Blonde', 'Skin Tone Fair', 'Skin Type Normal']",5 stars,15 Apr 2020,yes,Color: Orgasm,https://www.sephora.com/productimages/sku/s1943331+sw.jpg,BEST BLUSH EVER so natural,"Seems too much initially, but when you tap it around and massage into cheeks it really looks so natural - best blush in my life",4,0,Recommends this product
blush,NARS,NARS Liquid Blush,Clarios,VIB,Rookie,"['Eye Color Brown', 'Hair color Brunette', 'Skin Tone Medium', 'Skin Type Dry']",5 stars,15 Apr 2020,no,Color: Orgasm,https://www.sephora.com/productimages/sku/s1943331+sw.jpg,Love it,"I love this. Fast and easy to use, and easy to control the drama effect as well. Pretty color as one would expect from Orgasm. Little goes A LONG WAY. I have really dry skin and rarely break out so can’t speak to that.",0,0,Recommends this product
blush,NARS,NARS Liquid Blush,Brittni20,Insider,Rookie,"['Eye Color Brown', 'Hair color Blonde', 'Skin Tone Porcelain', 'Skin Type Dry']",5 stars,14 Apr 2020,no,Color: Orgasm,https://www.sephora.com/productimages/sku/s1943331+sw.jpg,Perfect Pink Blush!,"Incredibly beautiful blush. I apply this with an angled, fluffy brush. You need the tiniest little dot on the brush to cover both cheeks. The color is beautiful and I think it would look lovely on most skin tones. This is my go-to every day blush and I think it looks natural and lovely. The perfect pink. If you have never used a liquid blush, switch now and you will not look back! It gives such a natural look, especially if you have dry skin like me and powder products tend to sit on the top of your skin strangely.
…read more",5,0,Recommends this product
blush,NARS,NARS Liquid Blush,k4lista,Insider,Rookie,"['Eye Color Hazel', 'Hair color Black', 'Skin Tone Light', 'Skin Type Combination']",5 stars,13 Apr 2020,yes,Color: Orgasm,https://www.sephora.com/productimages/sku/s1943331+sw.jpg,blends good,"i thought it was going to be too heavy to blend out but it works good just dabbing out w fingers! and it doesn't bulk up in just one spot if u blend it out, looks even when i turn my cheek. overall i like it so far",3,0,Recommends this product
blush,NARS,NARS Liquid Blush,kingcassius,,,"['Eye Color Blue', 'Hair color Blonde', 'Skin Tone Light', 'Skin Type Dry']",5 stars,7 Apr 2020,yes,Color: Orgasm,https://www.sephora.com/productimages/sku/s1943331+sw.jpg,,"This is such a beautiful product. The finish is glowy and melts into the skin or foundation. YES, as everyone else noted, a little bit of this product goes a loooong way, but I see nothing wrong with that",4,1,Recommends this product
blush,NARS,NARS Liquid Blush,emmaandersonnn,VIB,Rookie,"['Eye Color Hazel', 'Hair color Brunette', 'Skin Tone Porcelain', 'Skin Type Normal']",3 stars,2 Apr 2020,yes,Color: Orgasm,https://www.sephora.com/productimages/sku/s1943331+sw.jpg,,it doesn’t blend too well and even with a tiny pump it comes out very fast and a lot goes on. i personally like powered blush after i tried this product.,1,0,
blush,NARS,NARS Liquid Blush,nunofurbusiness,,,"['Eye Color Brown', 'Hair color Black', 'Skin Tone Medium', 'Skin Type Oily']",5 stars,2 Apr 2020,yes,Color: Dolce Vita,https://www.sephora.com/productimages/sku/s1943307+sw.jpg,The best blush I have used thus far.,"The color is beautiful. I did not have any trouble controlling the amount of product I needed, applying a small pressure to the pump getting a little bit of the product on my finger before applying on the check and blending out with a foundation brush. The finish is very natural and matte with tiny simmers but not noticeable on the face.",2,0,Recommends this product
blush,NARS,NARS Liquid Blush,MaggieBrock,Insider,Rookie,"['Eye Color Blue', 'Hair color Blonde', 'Skin Tone Porcelain', 'Skin Type Oily']",4 stars,31 Mar 2020,yes,Color: Orgasm,https://www.sephora.com/productimages/sku/s1943331+sw.jpg,,"I love this product - but you have to be careful with your application! A little bit goes a long way, and I have found that using a beauty blender is the easiest way to get the desired look. I have not had any problems with the packaging/dispenser like many of the other reviews, and I think this is a great product. Stays on all day and looks great once you find the easiest way for yourself to apply it.",1,0,Recommends this product
blush,NARS,NARS Liquid Blush,NycoleKay,Insider,Rookie,"['Eye Color Brown', 'Hair color Brunette', 'Skin Tone Medium', 'Skin Type Combination']",5 stars,31 Mar 2020,no,Color: Orgasm,https://www.sephora.com/productimages/sku/s1943331+sw.jpg,I’m obsessed,Alrighty we all know liquid blush has been a trend and let me tell you I totally get the hype. If you are the type of person that likes a dewey look this is the product for you. A little goes a long way so this will last you a long time. I apply a small pump on the back of my hand and just dab it on with a Beaty blender. Gives you this cute rosy look without taking of your foundation underneath.,4,1,Recommends this product
blush,NARS,NARS Liquid Blush,blueberrysmum,,,"['Eye Color Blue', 'Hair color Brunette', 'Skin Tone Light', 'Skin Type Dry']",5 stars,30 Mar 2020,yes,Color: Orgasm,https://www.sephora.com/productimages/sku/s1943331+sw.jpg,"Really like, very natural looking.","After Perricone changed the formula of their “No make up blush” I decided to try this in universally flattering “Orgasm” since it has moisturizing coconut oil and vanilla extract. I wear both liquid and powder foundation and this goes nicely over both. A little goes a long way. Very lightweight, natural looking, no sparkles. One bottle will last a very long time, however, does not travel well (leaks all over no matter how well sealed) but sure it can be put in travel container of some sort such as make up syringes. Have the powder version of “Orgasm” blush also but this looks more natural.
…read more",9,0,Recommends this product
blush,NARS,NARS Liquid Blush,Siamblonde,Rouge,Rookie,"['Eye Color Brown', 'Hair color Blonde', 'Skin Tone Fair', 'Skin Type Dry']",3 stars,22 Mar 2020,no,Color: Orgasm,https://www.sephora.com/productimages/sku/s1943331+sw.jpg,"Looks great, doesn't last at all","I am disappointed in this product. The pump is useless as it pumps out way too much product and staying power is, well...no staying power for me. I layer it with Orgasm blush which should make it last but nothing. The colour is gorgeous, you can get a lovely glow that is not attainable with the powder blush orgasm. But this isn't a winner and not a product if you're wanting lasting power",0,0,
blush,NARS,NARS Liquid Blush,ahjumma,Rouge,Rookie,"['Eye Color Brown', 'Hair color Brunette', 'Skin Tone Tan', 'Skin Type Combination']",3 stars,17 Mar 2020,no,Color: Dolce Vita,https://www.sephora.com/productimages/sku/s1943307+sw.jpg,Bad Applicator,The color was gorgeous but the applicator really was a miss for me. I was constantly afraid it was going to go everywhere when I open it up. I love this product but I really don't like the applicator. Had to return it.,1,0,
blush,NARS,NARS Liquid Blush,MB36,Insider,Rookie,"['Eye Color Brown', 'Hair color Brunette', 'Skin Tone Medium', 'Skin Type Dry']",4 stars,15 Mar 2020,no,Color: Dolce Vita,https://www.sephora.com/productimages/sku/s1943307+sw.jpg,requires practice but well worth the effort...,"I love the color of this liquid blush. NARS really does offer quality products for a reasonable price particularly when compared to other brands. I bought dolce vita, a dusty rose color that compliments my olive skin tone well. The color payoff is fantastic almost too good for my lack of application skills. Lol That is the only reason I gave 4 stars instead of 5. The product is a bit runny which makes it difficult to apply especially since I’m not that skilled. The product also sets very quickly so there is little room for error or correction. That being said if & when you get the application just right it is definitely worth the effort. It looks phenomenal & has saying power unlike powder blushes. I am over 40 & recently decided to move away from powder products as they tend to age me by settling into not so fine lines.
…read more",6,0,Recommends this product
blush,NARS,NARS Liquid Blush,lenoratx,Insider,Rookie,"['Eye Color Brown', 'Hair color Blonde', 'Skin Tone Medium', 'Skin Type Combination']",5 stars,15 Mar 2020,no,Color: Torrid,https://www.sephora.com/productimages/sku/s1943323+sw.jpg,Long Lasting Blush!,This is a long lasting liquid blush that last all day.,6,1,Recommends this product
blush,NARS,NARS Liquid Blush,lefou,Rouge,Rookie,"['Eye Color Brown', 'Hair color Black', 'Skin Tone Light', 'Skin Type Combination']",2 stars,13 Mar 2020,no,Color: Torrid,https://www.sephora.com/productimages/sku/s1943323+sw.jpg,Not for starters. So pigmented.,Just not my thing. Easy to overdone even with a small amount of product. Not for starters. I will stick with 'Dandelion' from the benefit.,0,1,
blush,NARS,NARS Liquid Blush,liljoydropz,Insider,Rookie,"['Eye Color Brown', 'Hair color Black', 'Skin Tone Deep', 'Skin Type Dry']",4 stars,9 Mar 2020,no,Color: Orgasm,https://www.sephora.com/productimages/sku/s1943331+sw.jpg,Universally flattering shade for all skin tones.,"Beautiful, peachy shimmery tone. Sits beautifully on the skin, whether you use powder/cream foundation. Love the way this looks - a very natural flush of color if you use sparingly. The pump/bottle design is not great - keep it upright in your makeup bag or it will leak.",27,0,Recommends this product
blush,NARS,NARS Liquid Blush,903839,Rouge,Rookie,"['Age 25-34', 'Eye Color Brown', 'Hair color Brunette', 'Skin Tone Medium', 'Skin Type Combination']",4 stars,7 Mar 2020,no,Color: Torrid,https://www.sephora.com/productimages/sku/s1943323+sw.jpg,"Beautiful product, wish they would fix the pump.","Gorgeous, natural-looking flush with a hint of dew. The only con is the pump. I own 3 out of 4 shades and unfortunately, despite shaking prior to use, each of them get product stuck in the pump. I have to pump out the thickened product prior to each use, which is a waste.",3,0,Recommends this product
blush,NARS,NARS Liquid Blush,kassyslays90,Insider,Rookie,"['Eye Color Brown', 'Hair color Brunette', 'Skin Tone Light', 'Skin Type Normal']",2 stars,6 Mar 2020,no,Color: Orgasm,https://www.sephora.com/productimages/sku/s1943331+sw.jpg,A Swing and a Miss,"I have been searching for a blush that would give me a lasting and radiant flush and this was not it. Pro: a tiny bit goes a LONG way Con: a tiny bit too much and you look way overdone. It got everywhere easily and did NOT blend smoothly with or without primer or foundation. It just stuck fast to the spot you applied it. Nonetheless I kept trying to make it work for weeks because hello, it’s NARS. Eventually I decided it wasn’t worth the counter space and threw it in the trash. I recommend Nudestix Nudies Blooms
…read more",2,0,
blush,NARS,NARS Liquid Blush,Chineen,Rouge,Rookie,"['Age over 54', 'Eye Color Brown', 'Hair color Black', 'Skin Tone Dark', 'Skin Type Normal']",5 stars,3 Mar 2020,yes,Color: Torrid,https://www.sephora.com/productimages/sku/s1943323+sw.jpg,amazing,NARS is 100% my fave. Their liquid blush is a beautiful flush of color on the cheeks almost glowy. I love it!,6,0,Recommends this product
